{
  "contract_version": 2,
  "brief": {"title": "Deck 运行时验收", "objective": "验证流程页与证据页在同一 DOM 中放映和克隆。", "audience": "Wise PPT 维护者", "scenario": "运行时验收", "language": "zh-CN", "user_constraints": [{"constraint_id": "constraint.page-count", "type": "page_limit", "exact_pages": 2, "source_refs": ["src.runtime-fixture"]}, {"constraint_id": "constraint.no-thumbnails", "type": "must_avoid", "statement": "生成截图缩略图", "source_refs": ["src.runtime-fixture"]}], "gaps": []},
  "sources": [{"id": "src.runtime-fixture", "kind": "dataset", "title": "运行时合成数据", "locator": "inline://deck-contract-fixture", "synthetic": true, "notes": "只用于自动验收。"}],
  "assets": [],
  "content_items": [
    {"id": "item.delivery-process", "epistemic_role": "fact", "content_form": "process", "statement": "事实化、语义编排、主题渲染、契约验证依次完成。", "priority": "should", "status": "placeholder", "status_note": "合成测试数据，不代表真实业务事实。", "source_refs": ["src.runtime-fixture"], "atomic_values": [], "structured_data": {"steps": ["事实化", "语义编排", "主题渲染", "契约验证"]}, "relations": [{"type": "supports", "target_ref": "item.delivery-outcomes", "reason": "流程解释结果改善。"}]},
    {"id": "item.delivery-outcomes", "epistemic_role": "evidence", "content_form": "metric", "statement": "交付周期从 5 天降到 2 天。", "priority": "should", "status": "placeholder", "status_note": "合成测试数据，不代表真实业务事实。", "source_refs": ["src.runtime-fixture"], "atomic_values": [], "structured_data": {"before": 5, "after": 2, "unit": "天"}, "relations": [{"type": "supports", "target_ref": "item.flow-takeaway", "reason": "结果支撑结论。"}]},
    {"id": "item.flow-takeaway", "epistemic_role": "claim", "content_form": "prose", "statement": "机制与结果应连续阅读。", "priority": "should", "status": "placeholder", "status_note": "合成测试结论，不代表真实业务判断。", "source_refs": ["src.runtime-fixture"], "atomic_values": [], "relations": [{"type": "depends_on", "target_ref": "item.delivery-process", "reason": "结论依赖流程。"}]},
    {"id": "item.product-ui-state", "epistemic_role": "evidence", "content_form": "table", "statement": "12 个任务中 11 个成功、1 个重试。", "priority": "should", "status": "placeholder", "status_note": "合成测试数据，不代表真实业务事实。", "source_refs": ["src.runtime-fixture"], "atomic_values": [], "structured_data": {"total": 12, "success": 11, "retry": 1}, "relations": [{"type": "supports", "target_ref": "item.product-anomaly-note", "reason": "失败行提供证据。"}]},
    {"id": "item.product-latency-series", "epistemic_role": "evidence", "content_form": "metric", "statement": "延迟在 14:20 升至 620ms 后恢复。", "priority": "should", "status": "placeholder", "status_note": "合成测试数据，不代表真实业务事实。", "source_refs": ["src.runtime-fixture"], "atomic_values": [], "structured_data": {"points": [["14:00", 180], ["14:20", 620], ["14:40", 210]]}, "relations": [{"type": "supports", "target_ref": "item.product-anomaly-note", "reason": "峰值时间与失败时间一致。"}]},
    {"id": "item.product-anomaly-note", "epistemic_role": "claim", "content_form": "prose", "statement": "失败任务与延迟峰值同源。", "priority": "should", "status": "placeholder", "status_note": "合成测试结论，不代表真实业务判断。", "source_refs": ["src.runtime-fixture"], "atomic_values": [], "relations": [{"type": "depends_on", "target_ref": "item.product-ui-state", "reason": "判断依赖界面状态。"}]},
    {"id": "item.ui-takeaway", "epistemic_role": "claim", "content_form": "prose", "statement": "Canvas 趋势与界面证据共享同一页面。", "priority": "should", "status": "placeholder", "status_note": "合成测试结论，不代表真实业务判断。", "source_refs": ["src.runtime-fixture"], "atomic_values": [], "relations": [{"type": "depends_on", "target_ref": "item.product-anomaly-note", "reason": "结论依赖异常判断。"}]}
  ]
}
